{
  "id": "relationship:alice-case-team",
  "subjectId": "user:alice",
  "relation": "member_of",
  "objectId": "group:case-team",
  "sourceSystem": "mock",
  "assertedAt": "2026-05-21T17:00:00.000Z",
  "assertedBy": "service:mock-connector",
  "status": "active",
  "version": "tuple:v1",
  "createdAt": "2026-05-21T17:00:00.000Z"
}
